{"vending_support_team":"GIDUSR01","request_id":"auto-generated","global_id":"GID01","user_name":"GIDUSR01","contact_email_address":"requestor.owner@domain.com","aad_groups":{"owner":"xxxxx-xxxxx-xxxxx-xxxxx","reader":"zzzzz-zzzzz-zzzzz-zzzzz"},"tags":{"Application":"GID01","BusinessStream":"GID01","CostCenter":"123456"},"default_resource_groups":2,"subscriptions":[]}