{"vending_support_team":"FOOID01","request_id":"auto-generated","global_id":"FOOID01","user_name":"FOOID01","contact_email_address":"requestor.owner@domain.com","aad_groups":{"owner":"xxxxx-xxxxx-xxxxx-xxxxx","reader":"zzzzz-zzzzz-zzzzz-zzzzz"},"tags":{"Application":"FOOID01","BusinessStream":"FOOID01","CostCenter":"BAR01"},"default_resource_groups":2,"subscriptions":[]}